{
  "audit": {
    "context_hash": "fixture",
    "coverage": {
      "mapped_source_object_count": 0,
      "mapped_source_relationship_count": 0,
      "source_object_count": 0,
      "source_relationship_count": 0,
      "unmapped_source_object_count": 0,
      "unmapped_source_relationship_count": 0
    },
    "diagnostics_ref": "projection_diagnostics",
    "engine_version": "0.1.0",
    "fallbacks": [],
    "mapping_executions": [],
    "profile_id": "orthodox_astrology.v1",
    "profile_version": "1.0.0",
    "request_hash": "fixture",
    "source_graph_hash": "fixture",
    "unmapped_source_refs": []
  },
  "diagnostics": {
    "errors": [],
    "fallbacks": [],
    "infos": [],
    "unmapped_source_refs": [],
    "warnings": []
  },
  "indexes": {
    "object_by_id": {},
    "relationship_by_id": {}
  },
  "metadata": {
    "context_id": "orthodox.general.v1",
    "context_version": "1.0.0",
    "engine_version": "0.1.0",
    "package_type": "projected_semantic_graph",
    "profile_id": "orthodox_astrology.v1",
    "profile_version": "1.0.0",
    "projection_id": "projection:empty-fixture",
    "runtime_identity": {
      "identity_contract": "semantic_projection.runtime_identity.v1",
      "distribution": {
        "name": "semantic-projection-core",
        "version": "0.1.0",
        "package_version": "0.1.0"
      },
      "release_compatibility": {
        "contract_id": "semantic_projection.release_compatibility.v1",
        "resource_sha256": "0000000000000000000000000000000000000000000000000000000000000000"
      },
      "runtime_package": {
        "algorithm": "sha256(path + NUL + content_sha256 + LF)",
        "sha256": "0000000000000000000000000000000000000000000000000000000000000000",
        "resource_count": 1
      },
      "semantic_resources": {
        "algorithm": "sha256(path + NUL + content_sha256 + LF)",
        "sha256": "0000000000000000000000000000000000000000000000000000000000000000",
        "resource_count": 1
      },
      "schemas": {
        "algorithm": "sha256(path + NUL + content_sha256 + LF)",
        "sha256": "0000000000000000000000000000000000000000000000000000000000000000",
        "resource_count": 1
      },
      "profile": {
        "profile_id": "orthodox_astrology.v1",
        "profile_version": "1.0.0",
        "policy_resource_set": {
          "bundled": true,
          "algorithm": "sha256(path + NUL + content_sha256 + LF)",
          "sha256": "0000000000000000000000000000000000000000000000000000000000000000",
          "resource_count": 1
        }
      },
      "context": {
        "context_id": "orthodox.general.v1",
        "context_version": "1.0.0",
        "content_sha256": "0000000000000000000000000000000000000000000000000000000000000000",
        "bundled": true,
        "resource_path": "contexts/orthodox_general_context.json",
        "resource_sha256": "0000000000000000000000000000000000000000000000000000000000000000"
      },
      "route": "static_projection",
      "output_contract": "projected_semantic_graph.v1"
    }
  },
  "objects": [],
  "relationships": [],
  "source_graph_ref": {
    "graph_type": "canonical_astrology_graph",
    "graph_version": "1.3.0",
    "sensor_instance_id": "natal:fixture"
  },
  "source_identity": {
    "sensor_instance_id": "natal:fixture",
    "source_chart_id": "natal:fixture",
    "source_chart_ids": [
      "natal:fixture"
    ]
  },
  "summary": {
    "object_count": 0,
    "relationship_count": 0
  },
  "target_ontology": "orthodox_astrology.v1",
  "projected_term_registry": {}
}
